{
  "$schema": "https://json-schema.org/draft/2020-12/schema",
  "$id": "https://workkit.example/spec/v1alpha1/desired-setup.schema.json",
  "title": "DesiredSetup",
  "description": "Proposed structural contract; semantic validation and authority are separate.",
  "type": "object",
  "properties": {
    "apiVersion": {
      "const": "workkit/v1alpha1"
    },
    "kind": {
      "const": "DesiredSetup"
    },
    "metadata": {
      "type": "object",
      "properties": {
        "id": {
          "$ref": "https://workkit.example/spec/v1alpha1/common.schema.json#/$defs/id"
        },
        "revision": {
          "type": "integer",
          "minimum": 1
        }
      },
      "required": [
        "id",
        "revision"
      ],
      "additionalProperties": false
    },
    "spec": {
      "type": "object",
      "properties": {
        "connectionRef": {
          "$ref": "https://workkit.example/spec/v1alpha1/common.schema.json#/$defs/ref"
        },
        "containerId": {
          "type": "string",
          "minLength": 1
        },
        "fields": {
          "type": "array",
          "items": {
            "type": "object",
            "properties": {
              "logicalId": {
                "$ref": "https://workkit.example/spec/v1alpha1/common.schema.json#/$defs/id"
              },
              "nativeId": {
                "type": "string",
                "minLength": 1
              },
              "name": {
                "type": "string",
                "minLength": 1
              },
              "type": {
                "type": "string",
                "enum": [
                  "text",
                  "number",
                  "date",
                  "single-select",
                  "iteration"
                ]
              },
              "options": {
                "type": "array",
                "items": {
                  "type": "string",
                  "minLength": 1
                },
                "uniqueItems": true
              }
            },
            "required": [
              "logicalId",
              "name",
              "type",
              "options"
            ],
            "additionalProperties": false
          }
        },
        "views": {
          "type": "array",
          "items": {
            "$ref": "https://workkit.example/spec/v1alpha1/common.schema.json#/$defs/ref"
          }
        },
        "allowDestructive": {
          "const": false
        }
      },
      "required": [
        "connectionRef",
        "containerId",
        "fields",
        "views",
        "allowDestructive"
      ],
      "additionalProperties": false
    },
    "extensions": {
      "$ref": "https://workkit.example/spec/v1alpha1/common.schema.json#/$defs/extensions"
    }
  },
  "required": [
    "apiVersion",
    "kind",
    "metadata",
    "spec"
  ],
  "additionalProperties": false
}
