{
  "apiVersion": "workkit/v1alpha1",
  "kind": "DesiredSetup",
  "metadata": {
    "id": "desired-azure-devops",
    "revision": 1
  },
  "spec": {
    "connectionRef": {
      "kind": "ConnectionProfile",
      "id": "azure-devops",
      "revision": 1,
      "sha256": "cf0d9b4ad4054b60439a7cb91b00bc10a5cf9bcd2599a196a32ec941dd7f82bc"
    },
    "containerId": "container-synthetic",
    "fields": [
      {
        "logicalId": "title",
        "nativeId": "field-title",
        "name": "Title",
        "type": "text",
        "options": []
      }
    ],
    "views": [],
    "allowDestructive": false
  }
}
